{
  "policy_type": "ADMISSORIUM_MUTATION_CLASSIFICATION_POLICY",
  "schema_version": "1.0.0",
  "truth_warning": "NOT_TRUTH_SOURCE",
  "classes": [
    "projection_repair",
    "registry_candidate",
    "protected_truth_mutation",
    "authority_expansion",
    "release_mutation",
    "package_publish_path",
    "secret_bearing_artifact",
    "role_collapse",
    "current_truth_split"
  ],
  "red_classes": [
    "protected_truth_mutation",
    "authority_expansion",
    "package_publish_path",
    "secret_bearing_artifact",
    "role_collapse",
    "current_truth_split"
  ]
}
